{"$schema":"http://json-schema.org/draft-07/schema#","title":"TransactionAssessment v1","type":"object","additionalProperties":false,"required":["schemaVersion","assessmentId","eventId","transactionId","customerId","status","finalSeverity","ruleResults","rulesetVersion","receivedAt","evaluatedAt","late","traceId"],"properties":{"schemaVersion":{"const":1},"assessmentId":{"type":"string"},"eventId":{"type":"string"},"transactionId":{"type":"string"},"customerId":{"type":"string"},"status":{"enum":["NOT_SUSPICIOUS","SUSPICIOUS","INCONCLUSIVE"]},"finalSeverity":{"enum":["NONE","LOW","MEDIUM","HIGH","CRITICAL"]},"ruleResults":{"type":"array","items":{"type":"object"}},"rulesetVersion":{"type":"integer","minimum":1},"receivedAt":{"type":"string"},"evaluatedAt":{"type":"string"},"late":{"type":"boolean"},"traceId":{"type":"string"}}}
